{
  "schemaVersion": 1,
  "classPrefix": "",
  "separator": ":",
  "breakpoints": {
    "sm": "640px",
    "md": "768px",
    "lg": "1024px",
    "xl": "1280px"
  },
  "themes": {
    "default": {
      "colors": {
        "black": "#000000",
        "white": "#ffffff",
        "ink-50": "#eef3f9",
        "ink-100": "#d8e2ee",
        "ink-200": "#b9c7da",
        "ink-300": "#9bb0c6",
        "ink-400": "#73859f",
        "ink-500": "#4a5b73",
        "ink-700": "#273244",
        "ink-900": "#121826",
        "ink-950": "#0b0e14",
        "blue-50": "#eef5ff",
        "blue-100": "#dfeaff",
        "blue-200": "#c7dafc",
        "blue-300": "#a8c5f4",
        "blue-400": "#88aeea",
        "blue-500": "#6c95dd",
        "blue-700": "#4e6fbe",
        "blue-900": "#324a84",
        "violet-50": "#f3f0ff",
        "violet-100": "#e6e1ff",
        "violet-200": "#d0c7fb",
        "violet-300": "#b5a8f0",
        "violet-400": "#9a89e1",
        "violet-500": "#806ccd",
        "violet-700": "#5e4aa8",
        "violet-900": "#3d2d75",
        "teal-50": "#eefaf9",
        "teal-100": "#d6f3f1",
        "teal-200": "#b4e8e4",
        "teal-300": "#8cd8d2",
        "teal-400": "#64c2bb",
        "teal-500": "#3ea8a1",
        "teal-700": "#2b7c78",
        "teal-900": "#1c5451",
        "rose-50": "#fff1f5",
        "rose-100": "#ffe4ec",
        "rose-200": "#fec8d8",
        "rose-300": "#f5a5bf",
        "rose-400": "#e781a5",
        "rose-500": "#d45f8b",
        "rose-700": "#a34368",
        "rose-900": "#6e2d48",
        "amber-50": "#fff7e8",
        "amber-100": "#ffedd0",
        "amber-200": "#fdd9a8",
        "amber-300": "#f7c17e",
        "amber-400": "#e9a85a",
        "amber-500": "#d88d3a",
        "amber-700": "#a16222",
        "amber-900": "#6d3e14"
      },
      "font": {
        "sans": "\"Nunito Sans\", ui-sans-serif, system-ui, -apple-system, Segoe UI, Roboto, Arial",
        "mono": "\"DM Mono\", ui-monospace, SFMono-Regular, Menlo, Monaco, Consolas, monospace",
        "serif": "\"EB Garamond\", ui-serif, Georgia, Cambria, Times New Roman, Times, serif"
      }
    }
  },
  "fonts": {
    "imports": [
      "https://fonts.googleapis.com/css2?family=Nunito+Sans:wght@400;500;600;700&family=DM+Mono:wght@400;500&family=EB+Garamond:wght@400;500;600;700&display=swap"
    ]
  },
  "scales": {
    "space": {
      "0": "0",
      "1": "0.25rem",
      "2": "0.5rem",
      "3": "0.75rem",
      "4": "1rem",
      "5": "1.25rem",
      "6": "1.5rem",
      "8": "2rem",
      "10": "2.5rem",
      "12": "3rem",
      "14": "3.5rem",
      "16": "4rem",
      "20": "5rem",
      "24": "6rem",
      "28": "7rem",
      "32": "8rem",
      "36": "9rem",
      "40": "10rem",
      "48": "12rem",
      "56": "14rem",
      "64": "16rem"
    },
    "size": {
      "xs": "20rem",
      "sm": "24rem",
      "md": "28rem",
      "lg": "32rem",
      "xl": "36rem",
      "2xl": "42rem",
      "3xl": "48rem",
      "4xl": "56rem",
      "5xl": "64rem",
      "6xl": "72rem",
      "7xl": "80rem",
      "8xl": "90rem",
      "prose": "65ch"
    },
    "radius": {
      "none": "0",
      "sm": "0.125rem",
      "default": "0.375rem",
      "md": "0.5rem",
      "lg": "0.75rem",
      "xl": "1rem",
      "2xl": "1.5rem",
      "full": "9999px"
    },
    "borderWidth": {
      "0": "0",
      "1": "1px",
      "2": "2px",
      "4": "4px",
      "default": "1px"
    },
    "fontSize": {
      "xs": "0.75rem",
      "sm": "0.875rem",
      "base": "1rem",
      "lg": "1.125rem",
      "xl": "1.25rem",
      "2xl": "1.5rem",
      "3xl": "1.875rem",
      "4xl": "2.25rem",
      "5xl": "3rem",
      "6xl": "3.75rem",
      "7xl": "4.5rem",
      "8xl": "6rem"
    },
    "lineHeight": {
      "tight": "1.1",
      "snug": "1.25",
      "normal": "1.5",
      "relaxed": "1.625",
      "loose": "2"
    },
    "fontWeight": {
      "thin": "100",
      "extralight": "200",
      "light": "300",
      "normal": "400",
      "medium": "500",
      "semibold": "600",
      "bold": "700",
      "extrabold": "800",
      "black": "900"
    },
    "letterSpacing": {
      "tighter": "-0.05em",
      "tight": "-0.025em",
      "normal": "0",
      "wide": "0.025em",
      "wider": "0.05em",
      "widest": "0.1em"
    },
    "shadow": {
      "sm": "0 1px 2px 0 rgba(0, 0, 0, 0.45)",
      "default": "0 1px 3px 0 rgba(0, 0, 0, 0.5), 0 1px 2px -1px rgba(0, 0, 0, 0.4)",
      "md": "0 4px 6px -1px rgba(0, 0, 0, 0.5), 0 2px 4px -2px rgba(0, 0, 0, 0.4)",
      "lg": "0 10px 15px -3px rgba(0, 0, 0, 0.5), 0 4px 6px -4px rgba(0, 0, 0, 0.4)",
      "xl": "0 20px 25px -5px rgba(0, 0, 0, 0.5), 0 8px 10px -6px rgba(0, 0, 0, 0.35)",
      "2xl": "0 25px 50px -12px rgba(0, 0, 0, 0.6)",
      "inner": "inset 0 2px 4px 0 rgba(0, 0, 0, 0.4)"
    },
    "z": {
      "0": "0",
      "10": "10",
      "20": "20",
      "30": "30",
      "40": "40",
      "50": "50",
      "100": "100",
      "1000": "1000"
    },
    "opacity": {
      "0": "0",
      "5": "0.05",
      "10": "0.1",
      "20": "0.2",
      "25": "0.25",
      "30": "0.3",
      "40": "0.4",
      "50": "0.5",
      "60": "0.6",
      "70": "0.7",
      "75": "0.75",
      "80": "0.8",
      "90": "0.9",
      "95": "0.95",
      "100": "1"
    },
    "aspect": {
      "square": "1 / 1",
      "video": "16 / 9",
      "portrait": "3 / 4",
      "landscape": "4 / 3",
      "wide": "21 / 9"
    },
    "duration": {
      "75": "75ms",
      "100": "100ms",
      "150": "150ms",
      "200": "200ms",
      "300": "300ms",
      "500": "500ms",
      "700": "700ms",
      "1000": "1000ms"
    },
    "easing": {
      "linear": "linear",
      "in": "cubic-bezier(0.4, 0, 1, 1)",
      "out": "cubic-bezier(0, 0, 0.2, 1)",
      "in-out": "cubic-bezier(0.4, 0, 0.2, 1)"
    },
    "delay": {
      "0": "0ms",
      "75": "75ms",
      "100": "100ms",
      "150": "150ms",
      "200": "200ms",
      "300": "300ms",
      "500": "500ms",
      "700": "700ms",
      "1000": "1000ms"
    },
    "translate": {
      "0": "0",
      "1": "0.25rem",
      "2": "0.5rem",
      "3": "0.75rem",
      "4": "1rem",
      "5": "1.25rem",
      "6": "1.5rem",
      "8": "2rem",
      "10": "2.5rem",
      "12": "3rem",
      "16": "4rem",
      "20": "5rem",
      "24": "6rem",
      "32": "8rem",
      "40": "10rem",
      "48": "12rem",
      "56": "14rem",
      "64": "16rem",
      "full": "100%"
    },
    "rotate": {
      "0": "0deg",
      "1": "1deg",
      "2": "2deg",
      "3": "3deg",
      "6": "6deg",
      "12": "12deg",
      "45": "45deg",
      "90": "90deg",
      "180": "180deg"
    },
    "scale": {
      "0": "0",
      "50": "0.5",
      "75": "0.75",
      "90": "0.9",
      "95": "0.95",
      "100": "1",
      "105": "1.05",
      "110": "1.1",
      "125": "1.25",
      "150": "1.5"
    },
    "maxWidth": {
      "xs": "20rem",
      "sm": "24rem",
      "md": "28rem",
      "lg": "32rem",
      "xl": "36rem",
      "2xl": "42rem",
      "3xl": "48rem",
      "4xl": "56rem",
      "5xl": "64rem",
      "6xl": "72rem",
      "7xl": "80rem",
      "prose": "65ch"
    },
    "maxHeight": {
      "xs": "20rem",
      "sm": "24rem",
      "md": "28rem",
      "lg": "32rem",
      "xl": "36rem",
      "2xl": "42rem",
      "3xl": "48rem",
      "4xl": "56rem",
      "5xl": "64rem",
      "6xl": "72rem",
      "7xl": "80rem"
    },
    "container": {
      "default": "72rem",
      "sm": "640px",
      "md": "768px",
      "lg": "1024px",
      "xl": "1280px",
      "2xl": "1536px"
    }
  },
  "variants": {
    "responsive": ["sm", "md", "lg", "xl"],
    "state": ["hover", "focus", "active", "disabled"]
  },
  "build": {
    "content": ["./src/**/*.{html,tmpl,gohtml,tsx,jsx,vue,svelte,mdx}"],
    "safelist": [],
    "unknownClassPolicy": "warn",
    "emit": {
      "fontsCss": true,
      "tokensCss": true,
      "base": true,
      "manifest": true
    }
  }
}
